{
  "id": 1,
  "jsonrpc": "2.0",
  "method": "symbol/callers",
  "params": {
    "containingType": "com.example.Widget",
    "depth": 2,
    "direction": "outgoing",
    "fileHint": "/absolute/path/to/workspace/src/main/kotlin/example/Widget.kt",
    "kind": "property",
    "maxChildrenPerNode": 10,
    "maxTotalCalls": 50,
    "symbol": "Widget",
    "timeoutMillis": 5000,
    "workspaceRoot": "/absolute/path/to/workspace"
  }
}
